row_id,task,story_bucket,summ_bucket,story_tokens,summary_tokens,answer_tokens,story,question,answer,summary,target_words
7744,SUMM_SHORT,L_STORY,SHORT,830,43,4,"London, England (CNN) -- If the location is anything to go by, then the omens are promising. Denmark's capital city, Copenhagen -- host to the U.N. climate summit which starts today -- is already one of the greenest cities in Europe. With over 300 kilometers of cycle lanes it is estimated that around 40 percent of the 1.2 population travel to work on a bicycle. And visitors to the city are encouraged to join in by making use of the network of city bikes for a deposit of just 20 DKK ($4). The influence of two wheels has extended into Yuletide this year, as cyclists in City Hall Square are generating the electricity powering the lights on the Christmas tree. It's just one of hundreds of activities and events which Copenhageners have organized to coincide with the 11-day U.N. summit taking place at the Bella Center in the Orestad district in the southeast of the city. The opening of the summit marks the end of an exhaustive planning period by the city. Preparations at the Bella Center began two years ago. The finishing touches began eight weeks ago. ""It is, by far, the largest conference we have ever held and the largest political conference in Europe,"" the Bella Center press manager, Lars Lemche told CNN. ""If numbers continue to grow, it will be the biggest political meeting the U.N. has ever held,"" he said. The center has hosted big events before -- a European Union summit in 2002 and the 2006 MTV European Music Awards -- but the U.N. summit makes them look like a tea party. ""A conference is 36 hours. This is 11 days,"" Lemche said. The Bella Center has had to extend its floor space to 77,000 square meters -- the size of 11 football pitches -- to accommodate all delegates and 1000 staff will be on hand throughout. Numbers are expected to peak at around 18,000 in the second week when 100 heads of state arrive for the high-level political negotiations. This Herculean effort of planning is being backed up by a raft of green initiatives. Outside the conference center solar-powered streetlights are helping light the car parks. A wind turbine is helping power the lights indoors. Inside the conference center delegates will eat from a menu that is 65 percent organic and drink water that has come out of a tap rather than a bottle. Pens provided will be made from recycled plastic, and even the carpets are biodegradable. In a bid to offset the considerable carbon dioxide emissions - estimated to be 40,000 tons -- generated by the summit, organizers are funding the replacement of polluting brick factories in Dhaka, Bangladesh with 20 new efficient ones. Despite the disruption, Copenhageners have gone about their daily business as usual. Jason Heppenstall, Editor of The Copenhagen Post, a weekly English language newspaper told CNN: ""There hasn't been much of a build up until the last few days. Until about two weeks ago it's not been talked about a lot in the press and maybe a month ago half the people in Denmark didn't know there was going to be a conference,"" he told CNN. People are starting to notice changes now, and the mood among Copenhageners is positive, apart from the locals living near the Bella Center and whose lives have been disrupted by all the security arrangements, Heppenstall said. The concrete barriers and the perimeter fence erected to protect the Bella Center have been one of the more obvious signs of security in the city. And now that the conference has started, 6000 officers will be on duty during the conference. Niels-Otto Fisker, communications advisor to the Danish national police commissioner, told CNN: ""It is the single greatest operation that the Danish police have undertaken. Police are being drafted in from all over the country, and shifts are being extended from eight to 12-16 hours."" In all, the security operations are costing the Danish government an estimated $122 million. Last week, police unveiled a 22-ton vehicle armed with a water canon which will be used if trouble flares during the conference. The only confrontations in",What is one of the greenest cities in Europe?,"capital city, Copenhagen","Danish capital, Copenhagen, one of the greenest cities in Europe .
U.N. climate summit is biggest political event Denmark has hosted .
Copenhagen aims to be carbon neutral by 2025 .",32
6021,SUMM_SHORT,L_STORY,SHORT,829,48,3,"Editor's note: CNN.com's Wayne Drash writes about his maniacal love for University of Memphis basketball. Memphis, North Carolina, UCLA and Kansas play in the Final Four this weekend. Drash says the Memphis team can help heal the city's old wounds. CNN.com's Wayne Drash, left, says he's been hooked on University of Memphis basketball since he was a kid. ATLANTA, Georgia (CNN) -- My love for University of Memphis basketball is completely irrational. I never went to school there and have no affiliation with the university. But I bleed Tiger blue. My dad used to take my brothers and me to Memphis games as a kid, and I've been hooked ever since. We once bought tickets from a scalper for six bucks apiece against arch-rival the University of Louisville in the 1980s. My dad complained we paid too much. But then we moved in seventh grade. I became an even bigger fan after we left the city. I'd huddle over my AM radio, hooked up with a coat hanger wrapped in aluminum foil as an antenna. More than 350 miles away, I managed to pick up the then-Memphis State games through the crackle and static of the radio. Memphis basketball was my only way to remain connected to my youth and the city that I loved. That was 1985, the last time Memphis made the Final Four. Is your team in the Final Four? Send your iReport celebratory photos Back then, Memphis was led by a phenom named Keith Lee. He was best known for a sweet baseline jumper as soft as the nylon nets he swished. He was also known for his giant Afro. He was listed as 6 feet 10 inches. The joke was if you included his wild hairdo, he was 7-4. When my parents were away at work, sometimes I'd sneak into my mom's cabinet, steal her mousse and then put it in my hair. Then this white kid would go out back and shoot hoops for hours, hair sticking straight out like I stuck my finger in a socket. It was the only way I could be like Lee, my hero and idol. Back then, Memphians would rank Lee right up there with Elvis Presley as the city's most popular icons. Many still do. And that's the thing about Tiger basketball. In a place where race has often divided so much of it, Memphis basketball has helped unite the city. As a boy, white and black kids would crowd the basketball court at Tiger games to try to snatch the players' sweatbands as they raced into the locker room. Up until I graduated from high school, the sweatbands of Phillip ""Doom"" Haynes and Baskerville ""Batman"" Holmes sat on my shelf in my room. Like a fan of any team, there have been good and bad times over the years. But sometimes the pain of being a Tiger fan is that much greater. Tragedy and heartbreak are part of it, such as  when Holmes killed his girlfriend and then himself in 1997. Other players, such as Aaron Price and A. Maceo Battle, have died far too young along the way, furthering the pain of being a fan. Larry Finch -- who as a black player brought together the city and took Memphis to its only national championship game in 1973, and later became one of its greatest coaches -- has lived much of the past few years in a rehabilitation center after suffering severe strokes. In some ways, that's what makes Memphis basketball so special. Memphis players embody the real life of so many Americans, many faced with extreme hard times. Some succeed; some don't. Others, such as Finch, keep on fighting. I don't find it an accident that Memphis is now seeking history the same week of the 40th anniversary of the assassination of the Rev. Martin Luther King Jr. ""I think Dr. King would find this a source of joy,"" the Rev. Jesse Jackson told the team this week, according to the Memphis Commercial Appeal newspaper. A city that has seen so much pain, so much",what is the really special thing?,Memphis basketball,"University of Memphis basketball has brought together whites, blacks, fan says .
Memphis team has a chance to do something really special in Final Four, he says .
Memphis players embody struggle and aspirations of many Americans, fan says .",32
4969,SUMM_SHORT,L_STORY,SHORT,880,46,1,"(Tribune Media Services) -- Fantastique France continues to make its heritage and culture easier for travelers to appreciate. Being up-to-date on changes for 2009 will help your visit go smoothly. The Eiffel Tower is planning to offer online reservations, allowing visitors to book an entry time and avoid a long wait. Due to a smoking ban, you'll enjoy fresh air in bars, cafes and restaurants throughout France. The smokers have scurried outdoors to sidewalk tables; many of those seats now come with space heaters in winter. If you're traveling in France by railpass, it's increasingly important to book trips on the TGV bullet trains in advance, as there's a strict limit on the number of seats allowed for railpass holders. And with high gas prices -- and the recognition among Europeans that rail travel is about as green as you can go -- trains are more crowded than ever. In Paris, the transit system has introduced a chip-card called the Passe Navigo Decouverte, but for most tourists, the ""carnets"" (packs of 10 individual tickets) are still the better deal. The new Passe costs about $27, runs strictly from Monday through Sunday, and requires a photo, which means it's not shareable. In contrast, a 10-ticket pack costs about $14, is shareable, and has no expiration date. Paris' Notre-Dame Cathedral has a new modest-dress rule. The ""no shorts"" code is not strictly enforced, but inside you're expected to be quiet and respectful. A new online reservation system for the Eiffel Tower may debut in 2009, allowing Tour-Eiffel-ists to book a half-hour time slot and avoid the notorious lines. At the Army Museum nearby, the section on 19th-century French military history (""Revolution to Napoleon III"") should reopen in the spring. The museum also has a new Charles de Gaulle wing, offering a 25-minute film, plus a high-tech display of photos tracing the life of France's towering 20th-century figure. Paris' market streets delight many visitors. While rue Cler (near the Eiffel Tower) has become quite touristy, rue des Martyrs (at the foot of Montmartre) is edgier and a great way to connect with workaday Paris. If you'd like to ""do the Time Warp again"" while ducking airborne ""French"" toast, you can enjoy the cult movie ""Rocky Horror Picture Show"" with a Parisian crowd Friday and Saturday nights in the Latin Quarter (www.rocky.fr). Travel Snapshots: Paris The Palace of Versailles is undergoing extensive renovation so expect some closures. Repair projects may close its Opera House through June; the Petit Trianon may be closed or only partially open. Busy sightseers can save both time and money by visiting Versailles with the Paris Museum Pass. The pass covers most major sights in and around Paris, pays for itself in about three entries, and allows you to walk right by the long ticket-buying lines at places like the Louvre, the Orsay Museum, the Sainte-Chapelle chapel, and Versailles (www.parismuseumpass.com). However, everyone needs to wait through any bag-check security line. The charming city of Reims, rebuilt after World War I when Art Deco was the prevailing style, is now served by a speedy TGV train, making it an easy day trip from Paris. Reims is known for its champagne tours (Mumm, Taittinger and Martel), giant cathedral (with Chagall stained glass), and fascinating Museum of the Surrender (General Eisenhower's final World War II headquarters with stirring artifacts and the document of surrender that was signed by German generals right there). This year is the 65th anniversary of the D-Day landings in Normandy; prepare for big crowds -- especially from June 1 to 10. Also in Normandy, a museum has opened at Dead Man's Corner, a critical crossroads between Omaha and Utah beaches that saw five torrid days of fighting in 1944. This museum, south of Ste. Mere-Eglise, is a hit with enthusiasts as every display case shows incredible attention to detail. It also",What countries do the tours include?,France,"Rick Steves writes European travel guidebooks and hosts travel shows .
His TV series, ""Rick Steves' Europe,"" airs on PBS stations .
Steves' company, Europe Through the Back Door, conducts European tours .",32
8908,SUMM_SHORT,L_STORY,SHORT,786,54,3,"RECIFE, Brazil (CNN)  -- Eight more bodies have been recovered from last week's crash of an Air France jetliner in the Atlantic Ocean, bringing the total to 24, Brazil's military announced Monday. Recovery efforts have found several items confirmed to have come from Air France Flight 447. The bodies were found floating about 440 kilometers (273 miles) northeast of the Fernando de Noronha archipelago northeast of the Brazilian coast on Monday, military officials said Monday evening. Air France 447 disappeared over the Atlantic early June 1. The jet was en route to Paris, France, from the Brazilian city of Rio de Janeiro with 228 passengers and crew aboard. The military said earlier Monday that 16 bodies had been recovered. Items found in the same area Saturday were confirmed to have come from the jet, including pieces of the aircraft's wing section, luggage and a leather briefcase containing an airplane ticket with a reservation code for the doomed flight, Brazilian air force spokesman Jorge Amaral said. The exact location of the crash has not been determined, because ocean currents probably caused the bodies and debris to drift in the days since the crash. Two key pieces of evidence -- the flight data and cockpit voice recorders -- remain missing and could lie on the ocean floor.  Map of Flight 447's flight path » The part of the ocean where the debris and bodies have been found ranges from 6,000 to 8,000 meters (about 19,700 to 26,250 feet) deep. The search area covers 200,000 square kilometers (77,220 square miles), an area nearly as big as the country of Romania.  Watch CNN's Karl Penhaul report on more bodies found » Brazilian officials emphasized Monday that finding bodies was their priority. The French are in charge of finding the black boxes, and a submarine was en route as part of that mission. Fourteen aircraft -- 12 Brazilian and two French -- were participating, along with five Brazilian ships and one French frigate. In Washington, a U.S. defense official said the U.S. Navy will contribute two high-tech acoustic devices to listen for emergency beacons still operating in deep water. The ""towed pinger locators,"" which help search for emergency beacons on downed aircraft to a maximum depth of 20,000 feet, will be placed aboard two French tugs that are part of the search efforts, the official said. Recovery of bodies and debris is significant not only for families but also for crash investigators, said Mary Schiavo, a former inspector general for the U.S. Department of Transportation. ""Even if they don't find anything else, they can get some very important clues from the pieces that they do find and from the human remains,"" she said Saturday.  Watch an explanation of what could have caused the crash » She said investigators would be able to tell whether there was an explosion from possible residue on the bodies or other items. Or, if water is found in the lungs of victims, investigators would know that the plane went down intact, she said. Investigators in Paris said Saturday that the Air France flight sent 24 automated error messages about four minutes before it crashed. The messages suggest the plane may have been flying too fast or too slow through severe thunderstorms it encountered before the crash, officials said. Schiavo said four minutes ""was a very long time"" for automated signals to be sent from the plane. Investigators also reported that the airline had failed to replace a part as recommended by the manufacturer, Airbus. Airbus had advised airlines to update part of the equipment that monitors speed, known as pitot tubes. The recommendation was a result of technological developments and improvements, an Airbus spokesman said. The change was not mandatory, and the spokesman would not comment on Air France's failure to follow the advice. CNN's Karl Penhaul, Richard Quest, Helena DeMoura and Barbara Starr contributed to this report.",When did plane disappear?,June 1.,"NEW: Brazilian officials emphasize that finding bodies is their priority .
Military says total number of bodies found stands at 24 .
Plane disappeared over Atlantic Ocean last week .
U.S. to contribute high-tech devices to look for plane's emergency beacons .",32
1786,SUMM_SHORT,L_STORY,SHORT,795,36,2,"(CNN) -- Cuba is more than a thousand miles from my home in New York, but it's a place close to my heart. Steve Kastenbaum talks with Salomon Leyderman outside the Adath Israel synagogue in Havana, Cuba. I went to Cuba to report on a country that appears to be on the cusp of a new era. My focus was the future of U.S.-Cuban relations and the reforms under Cuban leader Raúl Castro. But a vague notion of exploring my family history in Cuba resulted in the most memorable story of the entire journey. More than 15,000 Jews were living in Cuba in the 1940s and '50s. Today, there are about 1,500. My grandmother, the daughter of Russian immigrants, was born in Havana, and my grandfather came to Cuba when he was just 3 years old. His family left Germany in the 1920s. To me, they were as much Cuban as they were Jewish.  Watch how everyday life has changed for Cubans » My grandparents left Cuba in the late '40s so that their children would be born in the United States. The last members of my family to leave Cuba did so post-revolution, in the 1960s. I was eager to see what had become of the places they left behind.  Slideshow: Learn more about the Jewish population in Cuba » When Castro lifted restrictions on religion in the mid-'90s, the once-dilapidated building that houses congregation El Patronato came back to life. Today, it's a thriving center for the local Jewish community. When I arrived, the children's summer program was in full swing. A few dozen boys and girls were laughing and playing as they waited for lunch to be served. I wasn't prepared for the wave of emotions that overcame me. Had things been different, I could have been just like them.  Slideshow: Experience more of Kastenbaum's explorations of Cuba » My next stop took me to Habana Viejo. Jewish life in Cuba has its roots in Old Havana, where my great-grandparents settled. I walked the streets where they lived and stopped in at the only remaining kosher butcher in town. I passed the building that once housed the local synagogue where my grandparents were wed.  Watch efforts to restore parts of Havana » The current home of Adath Israel is a few blocks away. At the front door, Salomon Leyderman introduced himself to me as the oldest Jew in Cuba. He's 86. I took out some old family photos, and Salomon immediately recognized my great-grandfather, Salomon Sher. He shouted out in Spanish, ""they were tailors!"" I couldn't believe my ears. This 86-year-old man told me how my great-grandfather was highly regarded in the community, how he belonged to many social organizations and how after the revolution, he made it possible for many Cuban Jews to leave the island and join him in Miami, Florida. As he looked at a family portrait, Salomon began to cry. He recognized Luis Sher, my grandmother's brother. He said Luis gave him as a gift a suit to wear at his bar mitzvah, the Jewish ceremony marking a boy's transition into manhood. It took place more than 70 years ago, but he recalled the details as if it happened yesterday. Tears were flowing down my cheeks, too. The following day, I called my father in New York and handed the cell phone to the oldest Jew in Cuba. This time there were no tears, just laughter. After the call, Salomon looked at my sneakers and said they're good shoes. He told me he's a European size 42, and I should bring him a pair when I return. He then asked me to send him a card on Hanukkah and smiled. Steve Kastenbaum is a New York correspondent for CNN Radio.",what heritage did the correspondent explore?,Cuba,"A CNN Radio correspondent explores his Jewish heritage in Cuba .
His grandparents left Cuba in the late 1940s .
An 86-year-old Jewish man remembered correspondent's family .",32
672,SUMM_SHORT,L_STORY,SHORT,805,49,7,"(CNN) -- A 19-year-old gunman who killed eight people and then himself Wednesday at the Westroads Mall in Omaha, Nebraska, left a suicide note, police said. Police have identified the gunman as Robert A. Hawkins, 19, of Nebraska. Five other people were injured, and two of them were in critical condition, hospital officials said. Chief Thomas Warren of the Omaha Police Department called the shooting ""premeditated,"" but said it ""appears to be very random and without provocation."" Surveillance cameras may have captured the shooting, Warren said. ""We'll be here throughout the night; it's a very extensive crime scene,"" he said. Police identified the gunman as Robert A. Hawkins of Nebraska. They have recovered an SKS assault rifle and the suspect's vehicle. Debora Maruca Kovac, Hawkins' landlord who found the suicide note, said he wrote he was sorry for everything and did not want to be a burden to anyone any longer.  Watch landlord describe phone call from shooter » Hawkins said in the note he loved his friends and family, but ""he was a piece of s--- all his life, and now he'll be famous,"" she told CNN. She said Hawkins was a friend of her sons and ""reminded me of a lost puppy that nobody wanted."" He came to live with her about a year and a half ago, telling her he could not stay with his own family because of ""some issues with his stepmother and him."" She described Hawkins as well-behaved, although ""he had a lot of emotional problems, obviously."" The shootings began about 1:42 p.m. Seven people were found dead at the scene by officers arriving six minutes later; two others, a male and a female, died after being transported to Creighton University Medical Center, said Fire Chief Robert Dahlquist. A Creighton spokeswoman said a second female was undergoing surgery and was in critical condition Wednesday afternoon. Three other people were taken to the University of Nebraska Medical Center. One, a 61-year-old man who sustained a chest wound after being shot in the armpit, underwent surgery and remained in critical condition in the intensive care unit Wednesday night, said hospital spokeswoman Maggie O'Brien.  Learn more about the victims » The other two -- a 34-year-old man who was shot in the arm, and a 55-year-old man who fell and struck a clothing rack as he was trying to escape -- were treated and released, she said. Maruca Kovac told CNN that Hawkins left home Wednesday about 11 a.m., and called the house about two hours later, sounding upset. ""He just said he wanted to thank me for everything I'd done for him ... and he was sorry,"" Maruca Kovac said. He told her he had gotten fired from his job, she said. ""I said, 'Come home and we'll talk about it,' "" she said. ""He said, 'It's too late.' He said he'd left a note explaining everything."" Witness Jennifer Kramer told CNN she heard at least 25 shots.  Watch witnesses describe the ordeal » ""He just kept firing,"" she said. She said she called 911 on her cell phone, whispering into it out of fear of being heard. A dispatcher told her other calls had been received and help was on the way, but she said it seemed to take ""a long time"" for them to arrive. ""It was just so loud, and then it was silence,"" she said. ""I was scared to death he'd be walking around looking for someone else."" She said as she was being escorted out by police, she saw a man lying injured by the escalator where she had been previously. ""All of us were slightly confused because we didn't know what it was,"" said mall employee Charissa Tatoon about the first burst of gunfire. ""Immediately after that, there was a series of maybe 20 to 25 more shots up on",What is the name of the landlord?,"Debora Maruca Kovac,","Landlord says shooter called and told her: ""It's too late""
Police: Surveillance cameras may have captured the shooting .
Police identify the shooter as Robert A. Hawkins, 19 .
Two of the wounded are in critical condition .",32
