row_id,task,story_bucket,summ_bucket,story_tokens,summary_tokens,answer_tokens,story,question,answer,summary,target_words
5521,SUMM_SHORT,L_STORY,SHORT,825,53,7,"BOGOTA, Colombia (CNN) -- The commander of the Revolutionary Armed Forces of Colombia's Force 47 told reporters in Bogota Monday -- a day after surrendering -- that ""the solution is not through war. There must be dialogue."" Nelly Avila Moreno, center, alias Karina, is escorted by soldiers after surrendering. Nelly Avila Moreno, 45, whose nom de guerre was Karina, said she and her longtime male companion made the decision jointly to abandon the FARC group, based in the jungle, at 5 a.m. Sunday. She said pressure from Colombian soldiers had been key to their decision, and she called on her fellow rebels to follow her example. ""I invite them to change the sensibility that is among the guerrillas,"" she said, seated by her companion, who said nothing during the news conference. She also had a message for the Colombian people: ""It is important to do something for peace in Colombia, and that need to do something is precisely one of my motivations."" After 24 years with the FARC, Karina said she wants to reintegrate with society. ""At this moment, what I am thinking about is reuniting with my family and with all of society,"" she said. Karina said she had had no contact with the group's leaders for the past two years. During that time, she said, ""I was trying to stay alive."" She said she knows nothing about the group's leaders, because ""everything in the FARC is very compartmentalized."" Still, she did hear through the news media about the killing by another member of FARC of Ivan Rios, a member of the group's central high command. ""We suffered a very strong blow,"" she said. She acknowledged that news led her to worry about the possibility that one of her fellow guerrillas might consider doing the same thing to her. ""A person has a lot of combatants alongside, but you don't know what each one is thinking,"" she said. Asked about news reports of guerrilla operations she may have participated in, Karina admitted to nothing. ""They accuse me of a lot of things I wasn't part of,"" she said. But Miguel Antonio Paez told CNN en Espanol that he remembers well the woman who, with a band of guerrillas, stopped the bus he was on in 2004 in northwest Colombia, ordered him and the other passengers off and the bus be burned. ""The commander of that guerrilla group -- a dark-haired woman, tall, with one eye missing -- called herself Karina,"" he said. ""She ordered me tied up. Here, I have the marks from the wires, and there, while I was tied up, she lopped off my penis and testicles and I remained castrated for all my life."" Asked specifically about the killing of the father of President Alvaro Uribe in 1983, she said she did not know who carried out the act, and added, ""I don't have my hands stained in that deed."" She said that with her surrender have come new fears about possible retribution from FARC loyalists, who consider her a traitor. Wearing a red sweatshirt and what appeared to be a diamond earring in her left ear, she said she once believed the FARC would rule Colombia. ""I once dreamed of that,"" she said. Gen. Mario Montoya, chief of the army, said two Colombian air force helicopters were sent Sunday to pick up Karina and her companion, who had given authorities their general location. ""With this, we have given a confounding strike to the FARC structure,"" particularly to Front 47, which at this point is practically dismantled,"" he said. Since the killing of Rios, 45 members of the group have laid down their arms and accepted a government plan for reinstallation into society, he said. ""We want to send a message to all members of FARC who persist in the mountains,"" he said. ""To tell them, what Karina has done is the road all the members",What rebel and her male companion surrender?,"Nelly Avila Moreno,","Rebel ""Karina"" and her male companion surrender .
Karina  was a commander of Colombian rebels .
She says, ""The solution is not through war. There must be dialogue""
She says she fears possible retribution from FARC loyalists .",32
3832,SUMM_SHORT,S_STORY,SHORT,529,54,2,"(CNN) -- The ambush by up to a dozen gunmen of a bus carrying members of the Sri Lankan cricket team in Lahore is the realization of fears long held by the sport's leading players.

Pakistani policemen outside The National Stadium after masked gunmen attacked the Sri Lankan cricket team in Lahore on March 3, 2009.

The Sri Lankan team had agreed to tour Pakistan after India pulled out in the aftermath of the terrorist attacks in Mumbai last November when more than 160 people died in a three-day siege.

The England team was in India -- but not in Mumbai -- during the attacks and promptly cut their tour short and returned home.

In September 2008, Cricket Australia decided to push ahead with a tour of India despite a series of bomb attacks in the country's capital New Delhi.

In March of the same year, they had pulled out of a tour of Pakistan after a spate of suicide bombings. Before that, the Australian team had not played in Pakistan for 10 years.

Such was the concern about the security risks presented to players in Pakistan that in August 2008 the International Cricket Council (ICC) announced the biennial Champions Trophy would be postponed until October 2009.

The ICC announced last month that it was investigating other venues after three countries -- England, New Zealand and Australia -- expressed reservations about touring Pakistan. South Africa pulled out of the 2008 competition citing security concerns.

Long before that, in 2002, a suicide bomb blast outside the New Zealand team's hotel prompted them to pack up and abandon the second Test series in Pakistan. The explosion injured the team physiotherapist and killed 11 French navy experts as well as two Pakistanis.

The previous year, the New Zealand team cancelled a scheduled tour of Pakistan in the aftermath of the September 11 attacks in the U.S.

Most of the team stayed on to play, though under increased security, when a suicide attack closed Colombo's international airport in July 2001.

In February 1996, Australia and the West Indies refused to play in preliminary World Cup matches in Sri Lanka after a huge bomb blast killed 80 people and injured 1,200 in Colombo.

In November 1992, also in Colombo, a suicide bomber detonated a bomb outside a hotel where the New Zealand team was having breakfast, killing four people. Five players and the coach were allowed to return home on compassionate grounds.

Five years earlier, in April 1987, the New Zealand team cut short a three-test tour of Sri Lanka after a car bomb killed 100 people at a bus station in Colombo.",Who is investigating?,The ICC,"Sri Lankan team agreed to replace India in Pakistan after Mumbai attacks .
International teams have long expressed concern about security in Pakistan .
Australian team pulled out of tour of Pakistan last year after suicide bombings .
ICC currently investigating other venues for postponed Champions Trophy .",32
1768,SUMM_SHORT,S_STORY,SHORT,471,45,7,"(CNN) -- Conservationists have found a new population of orangutans in a steep, mountainous corner of Indonesia -- a discovery that significantly adds to the number of the endangered red-haired primates.

The orangutans were discovered in a mountainous corner of Indonesia.

About 65,000 orangutans are thought to remain in the wild, limited to rain forests on two islands in Malaysia and Indonesia: Borneo and Sumatra.

The latest population was found in the eastern edge of Borneo, with conservationists counting 219 nests. Even by conservative estimates, that raises the total number of the orangutan population by at least a couple of hundred, maybe thousands.

""We rarely have something positive to report in the conservation world. Most of the stories are about declining population or animals dying. It's all pretty negative,"" said Erik Meijaard, a senior ecologist with the U.S.-based Nature Conservancy.

""So to find a substantial population of potentially several hundred to several thousand animals is very exciting.""

Locals in the area had long spoken of an orangutan population in the hard-to-access limestone mountains of the Kalimantan province. A group of conservationists reached the area in December after driving for a day, taking a boat for another, and then hiking across steep mountainous terrain for two, Meijaard said.

The remoteness of the area has meant that the animals have been undisturbed by development. Elsewhere, the orangutan's forest habitat has been cut down for timber extraction and palm oil, used in food and cosmetics.

Orangutans, a species of great apes, with hair that is usually reddish-brown instead of the black or brown. The name is derived from the Malay and Indonesian words for ""orang"" (person) and ""hutan"" (forest). They spend most of their time on trees, subsisting on fruit and leading a solitary existence except to mate.

The expedition in December found the nests crammed into just a few miles in the 2 million-acre forest.

""The immediate steps include going back to the area to see how far the population ranges and to put better protection in place,"" Meijaard said.",What was found in Indonesia?,new population of orangutans,"Conservationists have found a new population of orangutans in Indonesia .
Discovery significantly adds to number of the endangered red-haired primates .
Latest population was found in the eastern edge of Borneo .",32
385,SUMM_SHORT,L_STORY,SHORT,901,52,2,"(CNN)  -- Not content to sit quietly at home eating their tofu cutlets, more and more vegetarians, it seems, are taking action, trying to get the carnivorous masses to change their ways. 

Of course, the meat-free have been trying to win people over to their cause since the time of Pythagoras. But lately, activists are trying more in-your-face tactics. 

For Lierre Keith, author of ""The Vegetarian Myth,"" the ""in-your-face"" part is quite literal. A former vegetarian who has publicly recanted, she was lecturing in San Francisco, California, last week, when three masked assailants shouted ""Go vegan!"" and lobbed chili pepper-laced pies at her. 

Even in hard-core vegan circles -- which exclude using animal-based products for food, clothing, medicine or any other purpose -- such borderline-violent exploits are controversial. 

More common is the approach of folks like newly converted talk show host Ellen Degeneres, who has been sharing recipes for vegan nachos along with her philosophy. 

Still, recipes only go so far. And, more to the point, they don't get as much media attention. For many vegan and vegetarian activists, getting coverage is an art. 

PETA 

If you've ever read about a particularly outrageous pro-vegetarian campaign, there's a good chance that People for the Ethical Treatment of Animals was behind it. The folks at PETA seem to be firm believers in the idea that ""all media attention is good media attention,"" and the more shocking or ridiculous the stunt, the more media outlets will pick up the story. 

PETA was laughed at when it tried to rebrand fish as ""sea kittens,"" in hopes that the more cuddly name would make seafood a less appealing mealtime choice. It was criticized for the suggestion that recently deceased Oscar G. Mayer should be buried with his company's hot dog-shaped Wienermobile. 

After British celebrity chef Gordon Ramsay cooked up horse meat on his show, PETA UK dumped a ton of manure outside his London restaurant. 

Plenty of ecological activists cringe at these kinds of prankish maneuvers, but they do get noticed. And that, apparently, is the point. 

Why else would PETA organize an army of zombies to protest outside of KFC restaurants? 

Not content to oppose meat-eating in the real world, PETA also took a swipe at virtual carnivorousness: In response to the Nintendo DS game ""Cooking Mama,"" the group released its own bloody version. 

And, as anyone who's seen its anti-fur posters knows, PETA is well aware that sex sells. The group got the granddaughter of Argentinean revolutionary Che Guevara to pose wearing nothing but a bandolier filled with carrots. 

Last, year PETA proposed a too-racy-for-TV ""vegetarians have better sex"" Super Bowl commercial, guaranteeing plenty of coverage when -- surprise! -- NBC rejected the ad. 

PETA also brings its soft-core approach to the streets with its ""Lettuce Ladies"" campaign: young models, clad in a few strategically placed leaves, handing out veggie hot dogs. 

The group has enlisted Pamela Anderson and Elizabeth Berkley to pose for the Lettuce Ladies Web site (find it yourself) -- probably the best thing that's happened to their careers in years. Is there tofu wresting? Yes, there is tofu wrestling. 

Casa Diablo 

PETA is not alone in combining feminine pulchritude and an anti-meat agenda. A couple of years back, Portland, Oregon, resident Johnny Diablo got a bunch of media attention when he opened Casa Diablo, the world's first vegan strip club. 

Serving veggie burgers with a side of nudity (or maybe the other way around) might seem to be just a publicity stunt. (The fact that Diablo tried to put the club up for sale shortly after opening would seem to suggest that.) 

But Mr. Diablo is an earnest vegan himself, and he's apparently retained ownership of Casa Diablo, though reviews -- of both the cuisine and the more fleshy attractions -- are decidedly mixed",What is an art for many vegan and vegetarian activists?,getting coverage,"For many vegan and vegetarian activists, getting media attention is an art .
PETA seems to firmly believe that ""all media attention is good media attention""
Manure dumping, zombies, vegan strip club have been used to further the anti-meat cause .",32
4048,SUMM_SHORT,L_STORY,SHORT,861,42,6,"(CNN) -- The owner of a North Carolina beach house where seven college students died in a weekend fire said Monday that his family's ""lives were just changed forever"" by the tragedy.

Chip Auman said his 18-year-old daughter survived the fire but was hospitalized and in stable condition because of complications from smoke inhalation.

""The thought of losing a child is unimaginable to me, and as a father my heart goes out to the families that lost a loved one in this situation,"" he said.

Auman said the situation was ""hard to fathom.""

""There's just no words to describe what we've been going through,"" he said, asking for prayers for survivors and the families of those who died. ""We're numb, we're confused, we're heartbroken.""

Two college campuses mourned Monday.

Six University of South Carolina students and a Clemson University student died in the fire early Sunday morning in Ocean Isle Beach, North Carolina.

Six other South Carolina students were able to get out of the house in time. The six were treated and released from nearby Brunswick Community Hospital, but Auman's daughter was hospitalized again in Hartsville, South Carolina.

Authorities from the state Bureau of Investigation and the federal Bureau of Alcohol, Tobacco, Firearms and Explosives are leading the investigation into the cause of the fire.

Ocean Isle Beach Mayor Debbie Smith said the house was ""engulfed"" in flames when the fire department arrived on the scene, about five minutes after being notified. The flames shot into the sky and ultimately left little more than portions of the framing.

Fire officials do not believe foul play was involved.  Watch a neighbor's video, fears of fast-burning fire »

Dennis A. Pruitt, the vice president for student affairs for the University of South Carolina, said investigators have said it would be Tuesday or Wednesday before the identities of the victims are confirmed publicly.

It could be as much as a month until investigators know the cause of the fire, Pruitt said.

The university did not cancel classes on Monday, but Pruitt said arrangements had been made for those who need to go home or stay out of class at the 28,000-student campus.

Pruitt said meetings had been held Sunday with members of Delta Delta Delta sorority and Sigma Alpha Epsilon fraternity. The South Carolina students were affiliated with those houses, he said, although he stressed that the weekend was not an official Greek function.

He also said counselors and ministers were available to help students deal with the loss of their classmates.

The university president, Dr. Andrew Sorenson, contacted the families of those who died in the fire to express the condolences and support of the university community.

Jay Laura, student president of the USC chapter of Sigma Alpha Epsilon, said the campus would pull together after the tragedy.

""If any place can come together to help in the healing process and the aftermath of an event like this, it is South Carolina,"" Laura said at a Monday afternoon press conference.

Fire survivor Tripp Wylie, a 20-year-old South Carolina sophomore, said he jumped out of a third-story window into a canal to escape the flames and was unable to get back in to help his friends.

""I could see a buddy of mine off to the left who had gotten out. He was just yelling at me to jump and stuff,"" Wylie told CNN affiliate WYFF.

""The smoke was pouring out, couldn't really breathe, so I had to make a quick decision. [I] just kind of leaned out the window and luckily I jumped far enough to make it into the canal.""

Neighbors flocked to see the fire as firefighters battled and ultimately got the blaze under control.  See the scenes of devastation »

George Smith, who lives across the street from the house, said he heard sirens between 6:30 and 7 a.m. and went outside to see ""the whole sky lit up.""

""The whole house was completely engulfed in flames, up to about 20 feet,"" he said.",Which family member was among six survivors hospitalized?,18-year-old daughter,"""Heartbroken"" house owner's daughter among six survivors hospitalized .
One survivor jumped out of a third-story window into a canal to escape .
University of South Carolina mourns deaths of six students .",32
6000,SUMM_SHORT,L_STORY,SHORT,807,50,4,"Editor's note: CNN affiliates report on where job seekers are finding work across the country and how those looking for employment are coping with the situation. Baltimore Mayor Sheila Dixon, shown in April, once worked in a city jobs program as a youth. (CNN) -- Some of the stimulus money from the U.S. government is going to programs that help young adults find jobs. In Baltimore, Maryland, the city wants to put more than 7,000 to work, mostly in local government jobs. It will use more than $6 million from the federal government and sponsorship money, according to WBAL-TV in Baltimore. Baltimore Mayor Sheila Dixon recalled her days as a young worker. ""I worked at a camp, and then in high school, I was able to continue to work in the program,"" she said. Read the full report on WBAL In Palm Beach Gardens, Florida, Kahtoya Wesley, 20, has had difficulty finding a job, but she has a better chance of finding work now because she has joined the Summer Youth Employment Program, according to WPBF-TV in West Palm Beach. So far 200 people have landed jobs through the program, an initiative of the Workforce Alliance of Palm Beach County, WPBF reported. The organization is using $3 million of stimulus money to fund the positions the young adults find, the station said. iReport.com: Share your job hunt story The group also prepares the job seekers for interviews and provides seminars in how to deal with work-life situations. ""I got fired like five times. It was bad,"" John Hill told WPBF. He chose a seminar on working better with a supervisor. ""Because I usually don't,"" he told the station. Read the full report on WPBF The state of Arkansas is using federal money to fund jobs for at-risk students in Springdale, according to KHBS-TV in Fort Smith, Arkansas. The town's youth center hired five teens to work in clerical and maintenance positions, KHBS reported. David Cook told the station he has had trouble motivating himself to go to school. The summer job was helping him with a shift on focus. ""It gives me a sense of responsibility of showing up on time, working on a schedule and with other people,"" he told KHBS. Read the full report on KHBS West: FedEx center brings 650 jobs to Oregon Even before a new FedEx shipping center brings hundreds of jobs to Troutdale, Oregon, it is helping with employment through road construction jobs, according to KPTV-TV in Portland. The new hub, which is expected to be completed in July 2010, will bring more than 1,000 additional cars to the area, so the Oregon Department of Transportation called for two additional lanes at a nearby major intersection, KPTV reported. FedEx is expected to employ 650 workers at the facility once it opens, according to KPTV. ""We're creating family wage jobs, because this project will take place this summer,"" Troutdale Mayor Jim Kight told the station. Oregon's unemployment rate was a record 12.4 percent in May. Read the full report on KPTV South: No job? Create your own He was once a senior loan officer who had been laid off and was looking every day for a job anywhere there might be an opportunity. When he couldn't find the right chance, he created his own. Kenneth Hodge is now a small business owner, the founder of SFG Records. ""If you look at your failures, if you stare at your failures too long, you'll never go anywhere,"" Hodge told WPBF. ""But if you look beyond your failures, you can move to and fulfill your dreams. You can do that. I think I can do that, and we are doing that."" Six recording artists are featured on his Web site, and Hodge told the West Palm Beach station that he has already hired seven employees. Read the full report on WPBF Midwest: Iowa town sees trickle-down effect from stimulus Federal stimulus",What did a man lose his position as?,senior loan officer,"Job fair aimed at people 50 and older draws big crowd .
Pittsburgh area business executives meeting with high school students .
Wal-Mart adding 3,000 jobs in North Carolina .
Air Force recruiter in Florida has seen increase in interest .",32
2089,SUMM_SHORT,S_STORY,SHORT,734,55,7,"(CNN) -- For video game fans, many of the gadgets and accessories designed to support today's games are as unique and imaginative as the games themselves. 

From inflatable Wii racing karts to iPad joysticks and plastic assault rifles tailor-made for living room juntas, there's no shortage of weird, wild and occasionally even useful peripherals for handheld and set-top systems alike. 

Among the hundreds of available gaming gizmos and add-ons are a  coffin-shaped guitar instrument case and  blinged-out chrome plating for consoles. They're great to look at, but they won't enhance your gameplay much. 

Here are five recent accessories designed to improve your gaming experience: 

G155 ($299.99, http://www.projectgaems.com/) -- A portable game room to go, this carrying case unpacks to reveal a built-in 15.5-inch LED HD screen, stereo speakers and dual 3.5mm headphone jacks that let you annihilate friends or save the universe anywhere you travel. 

Pop an Xbox 360 or PlayStation 3 Slim in, hook up the HDMI cable, and assuming you don't mind a little heavy lifting, voila. You can spend family vacations with your head happily buried in ""WWE All Stars"" or ""Killzone 3."" 

Arcade FightStick Tournament Edition ($159.99, www.madcatz.com) -- Pricey, but infinitely cheaper than springing for an arcade machine, this PS3 and Xbox 360 joystick controller and eight-button pad delivers authentic coin-operated control and precision. 

Designed for use with popular fighting games such as ""Marvel vs. Capcom 3,"" it lets you plug in its 13-foot USB connector cable to enjoy customizable button mappings, turbo functionality and that classic quarter-munching feel. 

Charge Base for 3DS ($29.99, www.nyko.com) -- Given the Nintendo 3DS handheld 3-D gaming system's anemic 3- to 4- hour battery life, this useful combo charging dock and capacity-boosting rechargeable battery comes in especially handy by offering double the juice. 

It's not the most convenient accessory to carry around. But if you're planning on marathon play sessions, it can keep you happily splattering aliens or downing submarines twice as long as usual. 

PlayStation Move SharpShooter ($39.99) -- This plastic attachment lets you turn your PlayStation Move motion controller into a full-fledged rifle, theoretically providing greater accuracy and atmosphere in shooter games like the suddenly timely ""SOCOM 4: U.S. Navy SEALs."" 

Go ahead -- screw up your face and do your best ""Terminator"" impression. There's no denying the temptation to want to place your fingers on its pump-action grip. 

Harley Davidson: Road Trip with Accessory Bar ($29.99, www.eagl3.com) -- Of all the goofy gewgaws (e.g. plastic sword, shield, fishing rod, machine gun and jet-ski inserts) offered for Wii and PlayStation 3, we're partial to these motorcycle handlebars from InterWorks Unlimited, Inc. 

Crank up ""Born to Be Wild,"" twist the Wii remote to rev up, and you too can join the ranks of balding middle managers who spend their Sundays hitting the road on their virtual hog -- while reclining in a well-worn La-Z-Boy.",what g155 mean,"A portable game room to go,","Here are 5 suggestions for cool accessories to enhance your gaming experience .
The G155 portable game room packs speakers and a built-in 15.5-inch LED HD screen .
A combo charging dock and rechargeable battery will extend life of Nintendo's 3DS device .",32
